{
  "schema_version": "candidate-benchmark-lock-v1",
  "status": "locked",
  "locked_at": "2026-08-24T00:00:00Z",
  "candidate_id": "candidate-test",
  "candidate_sha256": "aaaaaaaaaaaaaaaaaaaaaaaaaaaaaaaaaaaaaaaaaaaaaaaaaaaaaaaaaaaaaaaa",
  "preparation_receipt_sha256": "bbbbbbbbbbbbbbbbbbbbbbbbbbbbbbbbbbbbbbbbbbbbbbbbbbbbbbbbbbbbbbbb",
  "candidate_repository": {
    "project": "synthetic-candidate",
    "merged_commit": "cccccccccccccccccccccccccccccccccccccccc",
    "worker_head_commit": "dddddddddddddddddddddddddddddddddddddddd",
    "pull_request": 17,
    "premerge_evidence_sha256": "3333333333333333333333333333333333333333333333333333333333333333",
    "merge_evidence_sha256": "4444444444444444444444444444444444444444444444444444444444444444",
    "public_blob_sha": {
      "candidate/candidate-ref.json": "5555555555555555555555555555555555555555",
      "candidate/layout-profile.json": "6666666666666666666666666666666666666666",
      "validation/candidate-preparation-report.json": "7777777777777777777777777777777777777777"
    }
  },
  "benchmark_repository": {
    "project": "synthetic-benchmark",
    "preparation_base_commit": "8888888888888888888888888888888888888888",
    "final_commit": "eeeeeeeeeeeeeeeeeeeeeeeeeeeeeeeeeeeeeeee",
    "benchmark_sha256": "ffffffffffffffffffffffffffffffffffffffffffffffffffffffffffffffff",
    "benchmark_file_sha256": "1111111111111111111111111111111111111111111111111111111111111111",
    "benchmark_path": "source/source-benchmark.v1.json",
    "blob_sha": "9999999999999999999999999999999999999999",
    "proof_evidence_sha256": "0000000000000000000000000000000000000000000000000000000000000000",
    "proof_observed_at": "2026-08-24T00:00:00Z"
  },
  "compatibility": {
    "source_sha256": "986a741c3f4566cb788fd9e6fed021355e4fc4ff7ca36a270eb957efbbdc5415",
    "source_edition": "Synthetic edition",
    "page_map_sha256": "32844a5664f8af36ae5ecdf6851b9aa4c9195f8b7cdea51fbf4553bc6f4ebcb5",
    "chunk_manifest_sha256": "5a49d97ee63a897a5343780347e681201e21dd97e21df1b2d66aa68a00515d83",
    "policy_sha256": "2222222222222222222222222222222222222222222222222222222222222222",
    "policy_profile": "subject-index-standard-policy-v1",
    "rubric_version": "subject-index-rubric-v4",
    "audit_mode": "full"
  },
  "lock_sha256": "e3760531247b0e7f7db451222addca57e4c0b1b01ad35e824a05ef4f3cfe0ca1"
}
